[{"Id":1,"From":37251,"To":38650,"Article":"Lorem ipsum dolor sit amet","Article author":"Lorem ipsum dolor sit amet","Article date":"","Title":"Lorem ipsum dolor si","Subtitle":"Lorem ipsum dolor sit a","Translation Article":"Lorem ipsum dolor sit","Translation Title":"Lorem ipsum dolor s","Translation Subtitle":"Lorem ipsum dolor sit ame","Translator":"Lorem ipsum do","Editor":"Lorem ipsum dolor s","Publisher":"Lorem","Publication date":34354,"Type":"Lorem ips","Author":"Lorem ipsum dolor sit amet, consectetur adi","City":"Lorem","Page count":"Lorem","Pages":"Lorem ips","Size":"Lorem ipsu","Format":"Lorem ips","ISBN":"Lorem ipsum d","URL":"Lorem ipsum dolor sit amet, consectetur adipiscing elit, sed do eiusmod tempor incididunt ut labore et dolore magna aliqua. Ut enim ad minim veniam, quis nostrud exercitation ullamco lab","Publication image":"Lorem ipsum dolor sit am","Description":"Lorem ipsum dolor sit amet, consectetur adipiscing elit, sed do eiusmod tempor incididunt ut labore et dolore magna aliqua. Ut enim ad minim veniam, quis nostrud exercitation ullamco laboris nisi ut aliquip ex ea commodo consequat. Duis aute irure dolor in reprehenderit in voluptate velit esse cillum dolore eu fugiat nulla pariatur. Excepteur sint occaecat cupidatat non proident, sunt in culpa qui officia deserunt mollit anim id est laborum. Lorem ipsum dolor sit amet, consectetur adipiscing elit, sed do eiusmod tempor incididunt ut labore et dolore magna aliqua. Ut enim ad minim veniam, quis nostrud exercitation ullamco laboris nisi ut aliquip ex ea commodo consequat. Duis aute irure dolor in reprehenderit in voluptate velit esse cillum dolore eu fugiat nulla pariatur. Excepteur sint occaecat cupid","Color":"#00FFFFC0"},{"Id":2,"From":36749,"To":32035,"Article":"Lorem ipsum dolor sit amet, consectetur adipiscing elit, sed do eiusmod tempor incididunt ut labore et d","Article author":"Lorem ipsum dolor sit amet, consectetur adipi","Article date":"","Title":"Lorem ipsum dol","Subtitle":"Lorem ipsum dolor sit a","Translation Article":"Lorem ipsum dolor sit amet, consectetur adipiscing elit, sed do eiusmod tempor incididu","Translation Title":"Lorem ipsum dolor","Translation Subtitle":"Lorem ipsum dolor ","Translator":"Lorem ipsum do","Editor":"Lorem ipsum ","Publisher":"Lorem","Publication date":35293,"Type":"Lorem ips","Author":"Lorem ipsum dolor sit amet, consectetur ","City":"Lorem","Page count":"Lorem","Pages":"","Size":"Lorem ipsu","Format":"Lorem ips","ISBN":"Lorem ipsum d","URL":"Lorem ipsum dolor sit amet, consectetur adipiscing","Publication image":"Lorem ipsum dolor s","Description":"Lorem ipsum dolor sit amet, consectetur adipiscing elit, sed do eiusmod tempor incididunt ut labore et dolore magna aliqua. Ut enim ad minim veniam, quis nostrud exercitation ullamco laboris nisi ut aliquip ex ea commodo consequat. D","Color":"#00FFFFC0"}]